Doctor name,Overall rating,Specialty,No. of reviews,Reviews,Review rating,Top 3 reviews,Bottom 3 reviews,Reviews mentioning disease,No. of reviews mentioning disease,Percentage of reviews mentioning disease
Dr. Rachel Trussart,5.0,Ophthalmologist,19,"['Excellente médecin, toujours disponible et agréable. Prise en charge complète et adéquate. Hautement professionnelle.', 'Excellent service de la part de cette spécialiste . Prend le temps de très bien expliquer le diagnostic et les traitements requis . Les lieux sont immaculés . Employés agréables . Temps d’attente pour notre rendez-vous raisonnable compte tenu d’un très grand achalandage . Heureux d’avoir cette docteure en ophtalmologie -rétinologue à TR .', 'J’ai fais opéré ma retine par elle. Très contente du résultat et de son travail. Je recommande sans aucune hésitation', 'Elle m’a opéré pour mon trou maculaire et m’a rendu la vue! Elle a aussi opéré un ami d’un decollement de retine qui avait très bien réussi. Les visites avec elle et sont équipes à sa clinique sont toujours plaisants. Merci Dr Trussart pour vos bons soins à Trois-Rivières.', 'Excellence chirurgicale et expertise de haut niveau. On me l’a fortement conseillé pour ma chirurgie de retine. Je suis tres satisfait du résultat.', 'je suis un patient du Dr Trussart qui m’a opere pour ma cataracte et ma membrane a la retine. tres bon service. je suis tres satisfait des resultats et je la recommande fortement. aussi j’ai ete tres bien recu a sa clinique avant et apres ma chirurgie. tous les membres de son équipe sont tres agréables.', 'Elle a le coeur a la bonne place. Tres content de ses services. J’aime son bureau qui accomode bien les personnes avec un handicap physique comme moi en chaise roulante. Les filles de son equipe sont toujours gentille avec moi', 'Elle m’a opéré pour mes cataractes et m’a redonné la vue. Merci!', 'Wow! On m’a référé d’urgence pour ma retine à ce médecin qui m’a reçu très rapidement et professionnellement. \n\nDepuis mon premier contact avec elle, je me suis toujours senti en confiance sous ses soins. Dr Trussart est tout simplement exceptionnelle de tous les points de vue. Les membres de son équipe à sa clinique sont aussi très compétents et agréables. Je suis très chanceux de l’avoir comme ophtalmologiste.', 'En pleine crise de la COVID, cette médecin a fait des démarches extraordinaires afin que je sois opérée rapidement pour mon décollement de la rétine. Elle n’a pas hésité à m’opérer un samedi à quelques heures d’avis. Je lui dois ma vue de mon oeil gauche. Remerciement très sincèrement à cette femme au grand coeur et à toute son équipe.', 'Super satisfait de ma chirurgie et des soins reçus. Je recommande fortement.', 'Médecin exceptionnelle à tous les points de vue.\n\nElle me traite avec des injections intraoculaires pour ma dégénérescence maculaire depuis 2018. Grâce à ses bons soins, je continue d’avoir la chance de pouvoir conduire, tricoter et surtout voir mes petits enfants grandir. Merci a Dre Trussart et toute son équipe!', 'Une excellente spécialiste de la rétine qui effectue un travail minutieux. Résultat très satisfaisant dont je suis extrêmement reconnaissant. Sa nouvelle clinique offre des services d’imagerie avant-gardiste dans notre région. Les suivis là-bas sont agréables tout est ultra moderne et rénové.', 'Dre Trussart est une chirurgienne incroyable avec un talent hors norme. J’ai été opéré par elle à la suite d’un grave accident à mon oeil. \n\nDre Trussart n’a jamais eu peur du défi chirurgical que mon cas représentait. Elle m’a accompagné tout au long de ce processus et elle a su me rassurer à travers les différentes étapes de ma réadaptation.\n\nC’est grâce à ce médecin que non seulement mon oeil a été sauvé mais aussi un très bon pourcentage de ma vision, ce qui est incroyable compte tenu de l’étendue des dommages que l’accident avait causé.\n\nJe vous la recommande fortement!', 'Dre Trussart est professionnelle, minutieuse et attentionnée. Je sens extrêmement choyée d’avoir été opéré par cette spécialiste pour mon trou maculaire. Je recommande fortement le Dr Trussart si vous avez besoin d’une chirurgie de la retine. Ses patients sont vraiment entre bonnes mains. Merci encore Dre Trussart pour votre beau travail. On est bien chanceux de vous avoir à Trois-Rivières! \n\nLyne', ""Elle m’a opéré la rétine. Grâce à elle je vois bien maintenant. J’ai vu autres docteurs pour les yeux avant elle qui ne savait pas quoi faire mais elle a immédiatement su ce que c'était et a fixé le problème. Au début j’avais peur de me faire opérer l’œil mais elle a été capable de me rassuré. La chirurgie s’est super bien passé. Dr Trussart est vraiment bonne. Merci. FS"", 'Dr Trussart est tout ce que l’on pourrait espérer d’un bon médecin. Aimable, extrêmement compétente, on sent qu’elle a complètement à coeur le bien être de ses patients. Elle m’a opéré pour un décollement de la rétine. Mon expérience sous les soins de cette médecin était très positive.', 'Met son patient en confiance, bonnes explications.', 'The doctor was very helpful , knowledgeable and enthusiastic about helping me.']","[5.0, 5.0, 5.0, 5.0, 5.0, 5.0, 5.0, 5.0, 5.0, 5.0, 5.0, 5.0, 5.0, 5.0, 5.0, 5.0, 5.0, 4.5, 5.0]","[(5.0, 'Excellente médecin, toujours disponible et agréable. Prise en charge complète et adéquate. Hautement professionnelle.'), (5.0, 'Excellent service de la part de cette spécialiste . Prend le temps de très bien expliquer le diagnostic et les traitements requis . Les lieux sont immaculés . Employés agréables . Temps d’attente pour notre rendez-vous raisonnable compte tenu d’un très grand achalandage . Heureux d’avoir cette docteure en ophtalmologie -rétinologue à TR .'), (5.0, 'J’ai fais opéré ma retine par elle. Très contente du résultat et de son travail. Je recommande sans aucune hésitation')]","[(4.5, 'Met son patient en confiance, bonnes explications.'), (5.0, 'Excellente médecin, toujours disponible et agréable. Prise en charge complète et adéquate. Hautement professionnelle.'), (5.0, 'Excellent service de la part de cette spécialiste . Prend le temps de très bien expliquer le diagnostic et les traitements requis . Les lieux sont immaculés . Employés agréables . Temps d’attente pour notre rendez-vous raisonnable compte tenu d’un très grand achalandage . Heureux d’avoir cette docteure en ophtalmologie -rétinologue à TR .')]","[(5.0, 'En pleine crise de la COVID, cette médecin a fait des démarches extraordinaires afin que je sois opérée rapidement pour mon décollement de la rétine. Elle n’a pas hésité à m’opérer un samedi à quelques heures d’avis. Je lui dois ma vue de mon oeil gauche. Remerciement très sincèrement à cette femme au grand coeur et à toute son équipe.'), (5.0, 'Médecin exceptionnelle à tous les points de vue.\n\nElle me traite avec des injections intraoculaires pour ma dégénérescence maculaire depuis 2018. Grâce à ses bons soins, je continue d’avoir la chance de pouvoir conduire, tricoter et surtout voir mes petits enfants grandir. Merci a Dre Trussart et toute son équipe!'), (5.0, 'Une excellente spécialiste de la rétine qui effectue un travail minutieux. Résultat très satisfaisant dont je suis extrêmement reconnaissant. Sa nouvelle clinique offre des services d’imagerie avant-gardiste dans notre région. Les suivis là-bas sont agréables tout est ultra moderne et rénové.'), (5.0, ""Elle m’a opéré la rétine. Grâce à elle je vois bien maintenant. J’ai vu autres docteurs pour les yeux avant elle qui ne savait pas quoi faire mais elle a immédiatement su ce que c'était et a fixé le problème. Au début j’avais peur de me faire opérer l’œil mais elle a été capable de me rassuré. La chirurgie s’est super bien passé. Dr Trussart est vraiment bonne. Merci. FS""), (5.0, 'Dr Trussart est tout ce que l’on pourrait espérer d’un bon médecin. Aimable, extrêmement compétente, on sent qu’elle a complètement à coeur le bien être de ses patients. Elle m’a opéré pour un décollement de la rétine. Mon expérience sous les soins de cette médecin était très positive.')]",5,26.3
Dr. Amer Omar,4.9,Ophthalmologist,24,"['Great dr. Take his time to explain exactly the problem and how he is going to treat it \n\nVery professional and kind person', 'EXCELLENT! Very knowledgeable. Would highly recommend him and his wonderful staff to anyone seeking the best professional care for their precious eyes!', 'C’est un spécialiste sûrement tres qualifier mais tres condescendant , pose lui pas deux fois la même question \n\nIl accepte pas que tu ne comprenne pas ce qui t’a expliqué la premiere fois même si tu es un peux nerveu d’apprendre ce qui t’arrive.', 'When it comes to microscopic details and cures, Dr. Omar is simply second to none ! Full explanation of before and after treatments in details. Professional and understanding. He answers everything you throw at him. Thank you Dr Omar.', 'Listens to the patient well. Very caring and takes time to answer all the questions.', 'EXCELLENT doctor!!!! Very calm and knowledgeable. He really takes his time and is understanding to your concerns.', 'I was first sent to Dr. Omar for a tear in my retina. He took the time to calm me by clearly explaining what had to be done, and then performing the laser procedure needed to close the tear, thereby restoring my eye back to normal. Since then, he and his excellent staff have taken wonderful care of my eye health, for which I am forever grateful. Dr. Omar is THE best at what he does, and he does so in a empathetic, reassuring & kind manner. That means a great deal to someone in a time of stress and worry. Would highly recommend him and his wonderful staff to anyone seeking the best professional care for their precious eyes!', 'Accessible, brilliant, able to explain issues in layman terms, punctual; excellent support staff', 'Amazing Doctor. Very pleased with overall experience. Thank you Dr Omar', 'I have been seeing Dr. Omar for about 2 years. He has helped me get my vision back. Very professional, knowledgeable and caring. The staff is very pleasant as well. Thank you so much Dr. Omar.', 'I saw Dr Omar 2 times , first for an emergency situation and then a follow up. Very thorough exams by staff and then with the Dr. Very professional, caring and knowledgeable, explained everything and my concerns. Very appreciative to have him as a dr here in Montreal.', 'The professionalism, knowledge and calm, caring communication that I experienced at this clinic were absolutely top-of-the-line! I will be happy to follow up with Dr. Omar next year as recommended.', 'Très attentionné et sensible aux appréhensions du patient', 'Very attentive service, very professional and courteous.', 'Fantastic Doctor..... very knowledgeable and knows how to get to facts very quickly. He comforted me in with the diagnosis and gave me hope for the future \n\nThank you Dr Omar ! Sergio', 'Great service, very knowledgeable and polite staff', ""Dr. Omar's precision and professionalism is unparalleled. He has a mastery of the retina and literally prevented me from having a retinal detachment through his exact and meticulous technique and expertise in retinal laser procedure. He was highly recommended by other ophthalmologists and optometrists and I have recommended him to all of my friends."", 'Très minutieux et excellente expertise de son art!', ""Every 4 weeks, for the last 3 years and a half, I visit Dr. Omar, for my Eylea injection. I trust him, I admire him and I'm happy that he is my ophtalmologist (it is not easy to live with severe wet macular degeneration). Thank you, Dr. Omar!"", 'Amazing Doctor...very pleased with everything...explaining what was wrong ...caring ...answering questions... so kind n understand...fantastic experience ....5 stars all the way', 'Dr Amer Omar commits to his profession, the likes of which I have never seen.\nHis abilities and accomplishments go unparalleled.\nI have never met a Doctor with such authenticity and benevolence towards his patients.\nHis acumen is a blessing to Quebec.', 'He is the best !! Very specialized !!! Knows exactly what he is taking about. Explains everything and very easy to understand his prognosis all the time !! THANK YOU Dr. Omar !!!', 'Dr. Amer Omar is a blessing for Quebec and we are fortunate to have him. Very specialized, educated and compassionate.', ""Super docteur, prends le temps de bien expliquer et est à l'écoute de ses patients""]","[5.0, 5.0, 3.0, 5.0, 5.0, 5.0, 5.0, 5.0, 5.0, 5.0, 5.0, 5.0, 5.0, 5.0, 5.0, 5.0, 5.0, 5.0, 5.0, 5.0, 5.0, 5.0, 5.0, 5.0]","[(5.0, 'Great dr. Take his time to explain exactly the problem and how he is going to treat it \n\nVery professional and kind person'), (5.0, 'EXCELLENT! Very knowledgeable. Would highly recommend him and his wonderful staff to anyone seeking the best professional care for their precious eyes!'), (5.0, 'When it comes to microscopic details and cures, Dr. Omar is simply second to none ! Full explanation of before and after treatments in details. Professional and understanding. He answers everything you throw at him. Thank you Dr Omar.')]","[(3.0, 'C’est un spécialiste sûrement tres qualifier mais tres condescendant , pose lui pas deux fois la même question \n\nIl accepte pas que tu ne comprenne pas ce qui t’a expliqué la premiere fois même si tu es un peux nerveu d’apprendre ce qui t’arrive.'), (5.0, 'Great dr. Take his time to explain exactly the problem and how he is going to treat it \n\nVery professional and kind person'), (5.0, 'EXCELLENT! Very knowledgeable. Would highly recommend him and his wonderful staff to anyone seeking the best professional care for their precious eyes!')]","[(5.0, 'I was first sent to Dr. Omar for a tear in my retina. He took the time to calm me by clearly explaining what had to be done, and then performing the laser procedure needed to close the tear, thereby restoring my eye back to normal. Since then, he and his excellent staff have taken wonderful care of my eye health, for which I am forever grateful. Dr. Omar is THE best at what he does, and he does so in a empathetic, reassuring & kind manner. That means a great deal to someone in a time of stress and worry. Would highly recommend him and his wonderful staff to anyone seeking the best professional care for their precious eyes!'), (5.0, ""Dr. Omar's precision and professionalism is unparalleled. He has a mastery of the retina and literally prevented me from having a retinal detachment through his exact and meticulous technique and expertise in retinal laser procedure. He was highly recommended by other ophthalmologists and optometrists and I have recommended him to all of my friends.""), (5.0, ""Every 4 weeks, for the last 3 years and a half, I visit Dr. Omar, for my Eylea injection. I trust him, I admire him and I'm happy that he is my ophtalmologist (it is not easy to live with severe wet macular degeneration). Thank you, Dr. Omar!"")]",3,12.5
