Dr. Michele Mabon,4.1,Ophthalmologist,20,"[""Dr Mabon m'a sauvé les yeux avec deux greffes de cornée. Très compétente dans son travail, très à l'écoute. Son assistante caro-lanne qui nous appel nous donne les informations et écoute nos craintes avec respect et empathie ! la seul chose c'est que l'attente est trop longue pour les rendez-vous à la clinic"", ""Dr. Mabon a commencé à me suivre à février 2014 pour un zona à l'oeil, l'ophtalmologiste qui me suivait ne savait plus quoi utiliser pour me soulager m'a référé au dr. Michele Mabon, spécialiste à hôpital Maisonneuve Rosemont, depuis 2019 mon dossier est à la clinique O, sans les compétences de cette exceptionnelle spécialiste je ne sais pas si mon œil aurait pu être sauvé. Je suis reconnaissante pour sa bienveillance, son attention à mon dossier. Lise Venne, septembre 2022"", 'What an amazing physician! Friendly, attentive, caring and very competent!', 'Great Doctor! She saw me as an emergency and took her time to examine me. Thank you Dr Mabon for listening to me and for your compassion and excellent explanation. \n\nThere should be more Drs like you in the medical field.', ""J'ai eu une correction de la cataracte de l'œil droit en décembre et une greffés de cornée en janvier. Le Dr Mabon est très dévouée, respecte ses patients et expliq"", 'A fantastic doctor! Treating me for recurrent corneal erosion. Takes all the time needed to explain. A beautiful human being, superb professional and great sense of humor!', ""I became visually impaired because of that doctor and her incapacity to listen. She will for a few things, but you need to insist... and for the most part, she feels the patient is stupid and knows nothing.\n\nI learned of my diagnosis from listening to her talk with the interns. She told me something different (and wrong). She would talk to them while turning her back to me, and ask questions to me in the same tone... I'd know she asked me a question because there would be sudden silence. Terrible manners.\n\nShe told me that what I had couldn't progress at my age, which is wrong... failed to listen to important details of my case (and later, failed to check what was sent to her by another doctor) which could have helped her not only confirm the diagnosis but pinpoint the precise type I had and choose the right treatment plan. Instead she went on with a wrong misconception and waited too long in between appointments, and later, for surgery. \n\nI would NOT recommend her. If you do get her as your eye doctor, do your own research, be prepared, and make sure she listens to the facts you have. Don't be afraid to (calmly) let her know why you think she is wrong... that's the only way she might listen."", 'Après avoir été opérée par elle, ma grand-mère a perdue la vue dans son œil', ""Dr. Mabon est une spécialiste très compétente et exerce sa profession avec passion. Elle m'a permis de revoir grâce à une greffe de la cornée endothéliale. J'ai été suivie et traitée avec vigilance et réflexion. Mon cas était particulier je n'ai qu'un bon oeil or étant donné mon jeune âge et le glaucome congénital dont je souffre le défi était de taille. Je suis extrêmement chanceuse et reconnaissante envers ce Doctor qui m'a permis de revoir... le plus précieux des cadeau!"", 'Failed to diagnose my mother\'s long standing dry form of macular degeneration which turned into wet. Told us to wait for an appointment with a retina specialist at the hospital she works at, which could take a couple of weeks. When I said I thought this was quite urgent she countered with ""it doesn\'t progess that fast"". Yes, the wet stage does progess fast and, yes, it is urgent. It is my opinion that this doctor is lacking in basic diagnostic and reasoning---go elsewhere. Also, there is one secretary, who if you have the misfortune of getting her on the phone, seems to think she is doing you a great favour by listening and then hangs up before you even have the chance to say goodbye.', ""Elle est une spécialiste des yeux qui est très humaine et elle explique dans tous les détails. à l'écoute de ses patients."", 'Personne humaine, sympathique, souriante, drôle, professionnelle. LA meilleure. A fait mes cataractes et lentilles intra-oculaire comme une vraie pro.', ""Elle m'a fait un tatouge sur l'iris dans les 2 yeux (post-iridotomie) et merveilleusement bien corrigé mon probleme de vision. Elle est super-sympatique !!"", ""Elle m'a sauvé la vie, lors d'un examen pour vérifier le nerf optique. Elle a vu un caillot dans le fond de mon oeil et m'a référée rapidement en chirurgie vasculaire. Sans elle je serais morte ou élgume aujourd'hui."", ""C'est vraiment une personne charmante et humaine,elle est vraiment dans son élément."", 'Très bonne chirurgienne, très compétente et elle est très sympathique.', ""Très professionnelle, simple et compétente. Elle m'a opéré pour deux cataractes sans complications. Elle est excellente."", ""Une personne très calme et explique vraiment bien dans des mots de monsieur tout l'monde. Elle me suit depuis quelques années et je vous la recommande si vous avez des problèmes de cornée. Chaleureuse et nous mets vraiment à l'aise. Elle à une très bonne écoute et elle aussi une personne simple."", ""Sincèrement déçue. N'a pas mis mon fils sur la liste d'attente pour greffe, alors que c'était un cas évident. Vit-elle sur la même planète que nous?"", ""Specialiste experte; excellente réputation dans son domaine. Explique très bien les procédures médicales; elle crée un environment de confiance et calme les inquiétudes. Comme toutes excellentes specialistes elle est surchargée d'ou les retards de rencontres.""]","[4.0, 5.0, 5.0, 5.0, 5.0, 5.0, 2.5, 1.0, 5.0, 3.0, 5.0, 5.0, 4.5, 5.0, 4.5, 5.0, 4.0, 4.5, 2.0, 4.0]","[(5.0, ""Dr. Mabon a commencé à me suivre à février 2014 pour un zona à l'oeil, l'ophtalmologiste qui me suivait ne savait plus quoi utiliser pour me soulager m'a référé au dr. Michele Mabon, spécialiste à hôpital Maisonneuve Rosemont, depuis 2019 mon dossier est à la clinique O, sans les compétences de cette exceptionnelle spécialiste je ne sais pas si mon œil aurait pu être sauvé. Je suis reconnaissante pour sa bienveillance, son attention à mon dossier. Lise Venne, septembre 2022""), (5.0, 'What an amazing physician! Friendly, attentive, caring and very competent!'), (5.0, 'Great Doctor! She saw me as an emergency and took her time to examine me. Thank you Dr Mabon for listening to me and for your compassion and excellent explanation. \n\nThere should be more Drs like you in the medical field.')]","[(1.0, 'Après avoir été opérée par elle, ma grand-mère a perdue la vue dans son œil'), (2.0, ""Sincèrement déçue. N'a pas mis mon fils sur la liste d'attente pour greffe, alors que c'était un cas évident. Vit-elle sur la même planète que nous?""), (2.5, ""I became visually impaired because of that doctor and her incapacity to listen. She will for a few things, but you need to insist... and for the most part, she feels the patient is stupid and knows nothing.\n\nI learned of my diagnosis from listening to her talk with the interns. She told me something different (and wrong). She would talk to them while turning her back to me, and ask questions to me in the same tone... I'd know she asked me a question because there would be sudden silence. Terrible manners.\n\nShe told me that what I had couldn't progress at my age, which is wrong... failed to listen to important details of my case (and later, failed to check what was sent to her by another doctor) which could have helped her not only confirm the diagnosis but pinpoint the precise type I had and choose the right treatment plan. Instead she went on with a wrong misconception and waited too long in between appointments, and later, for surgery. \n\nI would NOT recommend her. If you do get her as your eye doctor, do your own research, be prepared, and make sure she listens to the facts you have. Don't be afraid to (calmly) let her know why you think she is wrong... that's the only way she might listen."")]","[(3.0, 'Failed to diagnose my mother\'s long standing dry form of macular degeneration which turned into wet. Told us to wait for an appointment with a retina specialist at the hospital she works at, which could take a couple of weeks. When I said I thought this was quite urgent she countered with ""it doesn\'t progess that fast"". Yes, the wet stage does progess fast and, yes, it is urgent. It is my opinion that this doctor is lacking in basic diagnostic and reasoning---go elsewhere. Also, there is one secretary, who if you have the misfortune of getting her on the phone, seems to think she is doing you a great favour by listening and then hangs up before you even have the chance to say goodbye.')]",1,5.0
Dr. Girair Basmadjian,4.1,Ophthalmologist,16,"[""Fantastic doctor! Very attentive, caring and knowledgeable. He's been taking care of me for decades. I wouldn't trust my eyes or vision to anyone else."", 'Very professional thanks to him he saved my eyes after getting a dangereous bacteria and', ""Seemed okay but doesn't talk much nor does he investigate symptoms that. He ran only a couple of tests compared to another hospital who ran over 10 tests for me. Too old. Time to retire."", 'I have been a patient of Dr. Basmadjian for many years. St. Mary’s Hospital is very blessed to have him. He has always been courteous, and answers my anxious question. I highly rate his service. Laura Lee Reid', ""Traitée pour trouble à rétine. Traitement au laser. Je suis très satisfaite. Dr.Basadjian m'a bien expliquée ( bien sur,j'ai posé des questions additionnelles ).. il fut rassurant et je le recommande sans retenue."", ""Not satisfied at all. Detached vitreous, impaired vision, floaters, flashes, smudges.......and nothing. \n\nHe said nothing, offered no advice or expectation. Come back in 6 months, all that will stay there. It's not broken. \n\nSecond opinion coming. May end up being the same but Basmadjian's total indifference and aloof attitude is BS."", ""Dr. Basmadjian is the worst doctor ive ever seen! Him and his secretaries are unprofessional, they are either never there or redirecting the phone call. Ive had a stye for 1 year now and he did two surgeries and both of them failed! Truly the most unorganised, unprofessional, careless doctor ive ever seen. The only reason I'm rating dr. basmadjian 1/5 is because the 0/5 option is not available."", 'Very knowledgeable, compassionate, humanitarian and excellent at his job.\n\nI am blessed to be in his care!', 'A professional doctor. one of the best in his speciality.', ""He treated me for glaucoma and yet he wasn't a specialist which had terrible consequences. If I don't ask questions he never says anything and when you do ask, his answers are very brief and not reassuring. Whether he is a glaucoma or cataract specialist is still questionable."", 'Excellent retina specialist. Miracle worker who can quickly diagnose and save your vision with a few bursts of laser. We need more doctors like him who are calm, composed and knowledgeable.', 'Excellent Doctor! very caring and helpful and very knowledgeable!', ""Il m'a sauvé un oeil après que j'ai e un accident d'auto. Très bon médecin et excellent chirurgien."", ""Très compétent, courtois et à l'écoute de ses patients. Dr. Basmadjian est quelqu'un de très professionnel."", 'Good doctor and surgeon. Courteous, attentive and very knowledgeable on all aspects of medicine. Has been treating me since 1988!', ""J'aimerais avoir des commentaires des autres internautes...""]","[5.0, 5.0, 3.5, 5.0, 4.5, 2.0, 1.0, 5.0, 5.0, 2.0, 4.5, 5.0, 4.5, 5.0, 5.0, 4.5]","[(5.0, ""Fantastic doctor! Very attentive, caring and knowledgeable. He's been taking care of me for decades. I wouldn't trust my eyes or vision to anyone else.""), (5.0, 'Very professional thanks to him he saved my eyes after getting a dangereous bacteria and'), (5.0, 'I have been a patient of Dr. Basmadjian for many years. St. Mary’s Hospital is very blessed to have him. He has always been courteous, and answers my anxious question. I highly rate his service. Laura Lee Reid')]","[(1.0, ""Dr. Basmadjian is the worst doctor ive ever seen! Him and his secretaries are unprofessional, they are either never there or redirecting the phone call. Ive had a stye for 1 year now and he did two surgeries and both of them failed! Truly the most unorganised, unprofessional, careless doctor ive ever seen. The only reason I'm rating dr. basmadjian 1/5 is because the 0/5 option is not available.""), (2.0, ""Not satisfied at all. Detached vitreous, impaired vision, floaters, flashes, smudges.......and nothing. \n\nHe said nothing, offered no advice or expectation. Come back in 6 months, all that will stay there. It's not broken. \n\nSecond opinion coming. May end up being the same but Basmadjian's total indifference and aloof attitude is BS.""), (2.0, ""He treated me for glaucoma and yet he wasn't a specialist which had terrible consequences. If I don't ask questions he never says anything and when you do ask, his answers are very brief and not reassuring. Whether he is a glaucoma or cataract specialist is still questionable."")]","[(4.5, ""Traitée pour trouble à rétine. Traitement au laser. Je suis très satisfaite. Dr.Basadjian m'a bien expliquée ( bien sur,j'ai posé des questions additionnelles ).. il fut rassurant et je le recommande sans retenue.""), (4.5, 'Excellent retina specialist. Miracle worker who can quickly diagnose and save your vision with a few bursts of laser. We need more doctors like him who are calm, composed and knowledgeable.')]",2,12.5
Dr. Flavio Rezende,4.1,Ophthalmologist,15,"['Waiting for more than 5 hours after the appointment time.', ""Le meilleur., hyper competent. Très sollicité, donc rarement à l'heure. Soyez patients. Posez lui des questions, il vous répondra. Suivez ses directives. Vous êtes êtes bonnes mains."", ""Un médecin qui se prend pour un autre .. il n'est pas Dieu loin de la . Il ne t'écoute pas . Donne des rendez-vous à 7h30 mais arrive à 11h après sa collation ... tellement impoli... là grosse tête enflé mais il m'a opère pour ma rétine 4 fois et les 4 fois j'ai eu des problèmes. J'ai changé de médecin ."", 'Gives you an appointment at noon and calls your turn 4 - 6 hours later', ""Le Dr Flavio Rezende est l'un des meilleurs chirurgiens ophtalmologistes au Québec."", 'Facile d’approche et il te donne confiance directement. Bref, a conseillé! Ce n’ait pas pour rien que l’UdeM l’a fait venir du Brazil ! Il connaît son travail !', 'Les gens semblent l’idolatrer depuis qu’il passe à la tv mais ce chirurgien est un cowboy... Il m’a opéré pour un decollement a 2 reprises et chaque fois j’ai eu des complications. Même chose avec ma soeur qui s’est faite diagnostiquée le mauvais dx... Si vois avez la chance de choisir, ne choisissez pas celui-la', 'Being his patient for many years now he is the best doctor ever in all the sense ofthe word', 'Gentil et compétent. Malgré qu’il n’ait pas su m’expliquer l’origine de mon problème visuel, son assurance et son calme m’ont rassuré. Il a éliminé les causes graves et c’est le plus important.', ""J'ai eu un décollement de la rétine et été opéré pour vitrectomie œil droit au mois de septembre 2014.Dr Rezende est extraordinaire il est un super retinologue. Merci mille fois."", 'Afte 6 d’état he nets and other specialist, he is the only one that cared enough in the operating room to come near my ear and whisper that he was going to pay extra care to my remaining good eye .\n\nNever experience such a powerful trust in him even while trying new techniques.', 'Chirurgien ophtalmologue extraordinairement habile, le Dr Rezende a sauvé mon oeil droit. Tout le long du processus je me suis senti en pleine confiance. Merci beaucoup!', 'Knowledgeable, kind, and competent doctor. The rock star of eye specialists : )', ""Such a calm and reassuring doctor. I had to undergo 2 surgeries this past August for a torn retina. The first time I met with him was on a Saturday. I was surprised as I'd expected to be told to return on Monday. He was there having just performed a laser surgery on another patient just minutes before. I returned the following Monday and I was calmly told thatI'd need a 2nd surgery, which was done. I'm due for a follow-up in December but I can say that he saved my left eye...I had unwittingly waited 3 days to consult initially (which may very well have had reverse results). Thank you Dr. Rezende!"", 'Quiet, efficient and an extremely meticulous surgeon. Dr. Rezende saved my left eye, and managed to bring the vision up to 20/30. I highly recommend this surgeon.']","[3.0, 4.0, 2.0, 1.5, 4.5, 5.0, 2.5, 5.0, 4.5, 5.0, 5.0, 5.0, 5.0, 5.0, 5.0]","[(5.0, 'Facile d’approche et il te donne confiance directement. Bref, a conseillé! Ce n’ait pas pour rien que l’UdeM l’a fait venir du Brazil ! Il connaît son travail !'), (5.0, 'Being his patient for many years now he is the best doctor ever in all the sense ofthe word'), (5.0, ""J'ai eu un décollement de la rétine et été opéré pour vitrectomie œil droit au mois de septembre 2014.Dr Rezende est extraordinaire il est un super retinologue. Merci mille fois."")]","[(1.5, 'Gives you an appointment at noon and calls your turn 4 - 6 hours later'), (2.0, ""Un médecin qui se prend pour un autre .. il n'est pas Dieu loin de la . Il ne t'écoute pas . Donne des rendez-vous à 7h30 mais arrive à 11h après sa collation ... tellement impoli... là grosse tête enflé mais il m'a opère pour ma rétine 4 fois et les 4 fois j'ai eu des problèmes. J'ai changé de médecin .""), (2.5, 'Les gens semblent l’idolatrer depuis qu’il passe à la tv mais ce chirurgien est un cowboy... Il m’a opéré pour un decollement a 2 reprises et chaque fois j’ai eu des complications. Même chose avec ma soeur qui s’est faite diagnostiquée le mauvais dx... Si vois avez la chance de choisir, ne choisissez pas celui-la')]","[(2.0, ""Un médecin qui se prend pour un autre .. il n'est pas Dieu loin de la . Il ne t'écoute pas . Donne des rendez-vous à 7h30 mais arrive à 11h après sa collation ... tellement impoli... là grosse tête enflé mais il m'a opère pour ma rétine 4 fois et les 4 fois j'ai eu des problèmes. J'ai changé de médecin .""), (5.0, ""J'ai eu un décollement de la rétine et été opéré pour vitrectomie œil droit au mois de septembre 2014.Dr Rezende est extraordinaire il est un super retinologue. Merci mille fois.""), (5.0, ""Such a calm and reassuring doctor. I had to undergo 2 surgeries this past August for a torn retina. The first time I met with him was on a Saturday. I was surprised as I'd expected to be told to return on Monday. He was there having just performed a laser surgery on another patient just minutes before. I returned the following Monday and I was calmly told thatI'd need a 2nd surgery, which was done. I'm due for a follow-up in December but I can say that he saved my left eye...I had unwittingly waited 3 days to consult initially (which may very well have had reverse results). Thank you Dr. Rezende!"")]",3,20.0
Dr. Marie-Lyne Belair,4.1,Ophthalmologist,16,"['After 1st operation had follow up appointment with Doctor, we were sent to wrong floor/room waited 2hrs to be told we were all waiting in wrong area!!!!! After waiting for a long time to do 2nd cataract operation found her secretaries were misinformed about pre/operative information. Very frustrating!!!!', 'You may have to wait a long time at the hospital but Dr. Belair is more than worth the wait. I have been her patient for 15 years, ueveite chronique, and sheis amazing. When I was discouraged because my problem wouldn’t go away she was so encouraging. I count it a privilege to be her patient.', ""She helped me , listens to the patient, knowledgeable. She's great."", 'Excellente spécialiste. Très humaine. Elle cherche a comprendre ce qui arrive, pas seulement a traiter le bobo.', 'Elle m’as opéré pour des cataractes et j’avais une vision -24 et maintenant pour la première fois ddepuis ma vie j’ouvre les yeux et je vois sans lunettes ou verres de contacts. J’ai un grave problème de rétine sensible au déchirure et décollement et tout c’est bien passé. Un énorme merci au docteur Belair !!!', 'Always late and all patients are schedule at same time. 2 to 4 hours waiting time at office and 6 hrs at the hospital. Does not make sence...', 'Excellente. Elle a opéré mes deux yeux pour cataractes et ma vision est parfaite. je suis très reconnaissante. Merci beaucoup!', ""Bonjour, j'ai 21 ans et Dr. Bélair me suis depuis 3 ans pour des uvéites chroniques. Elle n'a toujours pas trouvé la maladie exacte, mais elle a su traiter le probl`me avec un immunosupresseur. Elle est gentille et tient vraiment à ses pateient. On sent qu'elle est présente pour nous malgré sa timidité. Elle semble être très active en recherche ce qui est rassurant, car elle doit se tenir au courant des nouvelles technologies. Je reocmmande vivement ce docteur."", 'Dr. Belair knows what she is talking about. Takes the time to explain problem. She takes care of any and all problems that we bring to her attention. The staff that registers us talk amongst themselves too much. We end up having to wait sometimes 45 minutes just to register. Then we wait anywhere between 3 to 5 hours to see Dr. Belair. This is an unreasonable amount of time to wait!!!!', 'Mon mari et moi avons été opérés par le Dr. Bélair pour nos cataractes. Nous avons été bien servis. Elle a pris le temps de bien nous expliquer la chirurgie et des risques possibles. Nous avons été opérés pour les deux yeux et nous sommes très satisfaits. Aucune complication et le suivi a été efficace. Nous sommes très reconnaissants.', ""Dame opérée pour cataractes aux 2 yeux et problème avec yeux après les opérations ... Dois retourner à plusieurs reprises à l'hôpital pour RDV = attention et $$$ stationnement ...Doit être rendu à plus de 100$ pour stationner !!! Dans la salle d'attente les patients présents on presque tous des problèmes après opération ... Docteure très froide et sans conversation ... a l'impression de déranger ... Mal chanceuse peut-être ... !!! ??? A vous de juger ..."", ""Dr.Bélair, ne cherchez pas ailleurs... c'est la meilleure. Une personne sérieuse et dévouée avec ses patients."", ""Quoique l'on attende longtemps à l'hôpital, Dr Bélair est très compétente et disponible. Dans son bureau, elle est totalement dévouée à son patient. Ce que j'apprécie aussi c'est qu'elle n'hésite pas à faire appel à ses collègues au moindre doute, contrairement à d'autres médecins qui se prennent pour des Joes Connaissants. Elle m'a opéré et me suit pour un oeil gravement malade. Je la recommande fortement."", ""Très consciencieuse, très à l'écoute de ses patients, cherche toujours à rassurer et explique bien les gestes qu'elle pose. Merci"", ""Bon medecin tres consciencieuse. Elle a opere mon epoux pour une cataracte et il attends pour l'operation du prochain. Tres douce. A recommander."", ""Petite dame tres douce. A opere mon epoux a un oeil pour cataracte. Tres competente. Reprendra la meme personne pour deuxieme oeil.Tres satisfait. Par contre l'attente est longue a l'hopital mais quand meme.""]","[2.0, 4.5, 5.0, 4.5, 5.0, 3.0, 5.0, 4.0, 4.0, 5.0, 2.0, 5.0, 4.5, 5.0, 4.5, 4.5]","[(5.0, ""She helped me , listens to the patient, knowledgeable. She's great.""), (5.0, 'Elle m’as opéré pour des cataractes et j’avais une vision -24 et maintenant pour la première fois ddepuis ma vie j’ouvre les yeux et je vois sans lunettes ou verres de contacts. J’ai un grave problème de rétine sensible au déchirure et décollement et tout c’est bien passé. Un énorme merci au docteur Belair !!!'), (5.0, 'Excellente. Elle a opéré mes deux yeux pour cataractes et ma vision est parfaite. je suis très reconnaissante. Merci beaucoup!')]","[(2.0, 'After 1st operation had follow up appointment with Doctor, we were sent to wrong floor/room waited 2hrs to be told we were all waiting in wrong area!!!!! After waiting for a long time to do 2nd cataract operation found her secretaries were misinformed about pre/operative information. Very frustrating!!!!'), (2.0, ""Dame opérée pour cataractes aux 2 yeux et problème avec yeux après les opérations ... Dois retourner à plusieurs reprises à l'hôpital pour RDV = attention et $$$ stationnement ...Doit être rendu à plus de 100$ pour stationner !!! Dans la salle d'attente les patients présents on presque tous des problèmes après opération ... Docteure très froide et sans conversation ... a l'impression de déranger ... Mal chanceuse peut-être ... !!! ??? A vous de juger ...""), (3.0, 'Always late and all patients are schedule at same time. 2 to 4 hours waiting time at office and 6 hrs at the hospital. Does not make sence...')]","[(5.0, 'Elle m’as opéré pour des cataractes et j’avais une vision -24 et maintenant pour la première fois ddepuis ma vie j’ouvre les yeux et je vois sans lunettes ou verres de contacts. J’ai un grave problème de rétine sensible au déchirure et décollement et tout c’est bien passé. Un énorme merci au docteur Belair !!!')]",1,6.2
